{
  "assessment_digest": "sha256:ca07ce47b00ee38cc2ad09513985b32dd4136a485f5382c9d0483ae39351b114",
  "assessment_id": "asm_n2_d0483ae39351b114",
  "comment_id": 5097285326,
  "created_at": "2026-07-27T22:01:40.678Z",
  "created_by_run": "run_2026-07-28-v3",
  "dedup_fingerprint": "sha256:caa0562ffcb031f2e83e40677a7c01eb9efc8b110db70083ac008cad03b769c6",
  "issue_number": 2,
  "repository": "EricSanchezok/good-stuff-for-agents",
  "response_id": "rsp_n2_ac008cad03b769c6_posted",
  "response_state": "posted",
  "schema_version": 1,
  "template_version": "issue-factual-v1",
  "toctou_state": {
    "bound_digest": "sha256:962d9a3e86ff3b72fb4641c266286d3e39efd88c41acaa3aec179b52ea7c1b40",
    "checked_at": "2026-07-27T22:01:39.215Z",
    "current_digest": "sha256:962d9a3e86ff3b72fb4641c266286d3e39efd88c41acaa3aec179b52ea7c1b40",
    "issue_updated_at": "2026-07-21T11:44:10Z",
    "staleness": "current"
  }
}
